مدخل,هدف
سؤال: تيريسا تكذب. كريستيان يقول تيريسا تكذب. يقول سال إن كريستيان يقول الحقيقة. تقول أودري سال تكذب. تقول ليدا أن أودري تكذب. هل تقول ليدا الحقيقة؟,نعم
سؤال: هيلين تقول الحقيقة. لورين تقول هيلين تكذب. يقول ريموند لورين تقول الحقيقة. يقول كا أن ريموند يقول الحقيقة. كريستي تقول أن كا تقول الحقيقة. هل تقول كريستي الحقيقة؟,No
سؤال: ريان يكذب. كاندي يقول رايان يكذب. لورين تقول كاندي أكاذيب. كريستي تقول لورين تقول الحقيقة. يقول فليتشر أن كريستي تكذب. هل يقول فليتشر الحقيقة؟,نعم
سؤال: جامع يكذب. يقول جوين أن جامي يقول الحقيقة. يقول يولاند أن جوين يقول الحقيقة. يقول كاندي إن يولاند يقول الحقيقة. يقول أوزفالدو أن كاندي تقول الحقيقة. هل يقول أوزفالدو الحقيقة؟,No
سئل: انطوان يقول الحقيقة. تقول هيلين إن أنطوان يقول الحقيقة. يقول جوين أن هيلين تقول الحقيقة. يقول سال إن جوين يقول الحقيقة. شاوندا يقول سال يكذب. هل تقول شاوندا الحقيقة؟,No
سؤال: جيم يقول الحقيقة. تاميكا تقول أن جيم يقول الحقيقة. تقول هيلين تاميكا تقول الحقيقة. يقول Jaymie هيلين تقول الحقيقة. يقول الحمل أن Jaymie يقول الحقيقة. هل الحمل يقول الحقيقة؟,نعم
سؤال: سيما تقول الحقيقة. جيم يقول سيما الأكاذيب. يقول جوين أن جيم يقول الحقيقة. تقول فيبي إن جوين يقول الحقيقة. رشيدة تقول فيبي تكذب. هل تقول رشيدة الحقيقة؟,نعم
سؤال: جامع يقول الحقيقة. تقول دلفينا أن جامع تكذب. تقول فينا أن دلفينا تقول الحقيقة. تقول تيريسا أن فينا تقول الحقيقة. الحمل يقول أن تيريسا تكذب. هل الحمل يقول الحقيقة؟,نعم
سؤال: فيبي تقول الحقيقة. هيلين تقول فيبي تكذب. سيما تقول هيلين تكذب. يقول أليخاندرو أن سيما تقول الحقيقة. تقول ميكايلا إن أليخاندرو يكذب. هل تقول ميكايلا الحقيقة؟,No
سؤال: سيما تقول الحقيقة. تقول تيريسا أن سيما تقول الحقيقة. تقول فينا أن تيريسا تكذب. يقول كريستا فينا يكذب. تقول فيبي إن كريستا تقول الحقيقة. هل فيبي تقول الحقيقة؟,نعم
سؤال: جامع يكذب. تقول ميكايلا إن جامي يقول الحقيقة. ميليسنت يقول ميكايلا تكذب. يقول إيلانور إن ميليسنت تقول الحقيقة. رشيدة تقول إن النور تكذب. هل تقول رشيدة الحقيقة؟,No
سؤال: ميليسنت تقول الحقيقة. الكسيس يقول ميليسنت أكاذيب. Jaymie يقول الكسيس يكذب. يقول ويليان أن جيمي يقول الحقيقة. تقول ليدا أن ويليان يكذب. هل تقول ليدا الحقيقة؟,No
سؤال: Jaymie يكذب. تقول كريستي أن جيمي يقول الحقيقة. أليخاندرو يقول كريستي تكذب. يقول جوين أن أليخاندرو يقول الحقيقة. سال يقول جوين يكذب. هل يقول سال الحقيقة؟,No
سؤال: مايكل يكذب. تقول ليدا أن مايكل يكذب. يقول دلبيرت أن ليدا تقول الحقيقة. تقول تاميكا أن ديلبرت يقول الحقيقة. يقول فيدل إن تاميكا تكذب. هل يقول فيدل الحقيقة؟,No
سؤال: ليدا تقول الحقيقة. تقول فينا أن ليدا تكذب. تقول دلفينا أن فينا تقول الحقيقة. أليخاندرو يقول أن دلفينا تكذب. يقول شاوندا أن أليخاندرو يقول الحقيقة. هل تقول شاوندا الحقيقة؟,نعم
سؤال: اندريه يكذب. يقول دلفينا أن أندريه يكذب. يقول جيم أن دلفينا تقول الحقيقة. يقول جوين أن جيم يكذب. يقول دلبيرت أن جوين تكذب. هل يقول ديلبرت الحقيقة؟,نعم
سؤال: اندريه يكذب. Jamey يقول Andree يكذب. يقول شاوندا أن جامي يكذب. تقول دلفينا إن شاوندا تكذب. كريستي تقول أن دلفينا تكذب. هل تقول كريستي الحقيقة؟,No
سؤال: كريستا تقول الحقيقة. يقول شالوندا أن كريستا تكذب. يقول ميليسنت أن شالوندا يكذب. يقول فيرنيل إن ميليسنت أكاذيب. يقول إنجا أن فيرنيل يقول الحقيقة. هل تقول إنجا الحقيقة؟,No
سؤال: الحمل يقول الحقيقة. يقول إيلانور إن الحمل يقول الحقيقة. يقول الكسيس أن إيلانور تقول الحقيقة. يقول فيدل أن أليكسيس يقول الحقيقة. يقول دلبيرت أن فيدل يكذب. هل يقول ديلبرت الحقيقة؟,No
سؤال: إيلانور تقول الحقيقة. تقول ليدا أن إيلانور تكذب. يقول أوزفالدو أن ليدا تقول الحقيقة. يقول جيم أوزفالدو أكاذيب. يقول جوين أن جيم يكذب. هل يقول جوين الحقيقة؟,No
سؤال: ريان يقول الحقيقة. يقول شاوندا أن ريان يقول الحقيقة. تقول ليدا إن شاوندا تكذب. تيريسا تقول أن ليدا تكذب. تقول كريستي أن تيريسا تقول الحقيقة. هل تقول كريستي الحقيقة؟,نعم
سؤال: شوندا أكاذيب. يقول ريان أن شاوندا تقول الحقيقة. شالوندا يقول ريان يكذب. بيرنيتا تقول أن شالوندا يكذب. تقول ميكايلا إن بيرنيتا تقول الحقيقة. هل تقول ميكايلا الحقيقة؟,No
سؤال: الكسيس يقول الحقيقة. تقول شنا أن أليكسيس يقول الحقيقة. يقول يولاند إن شينا تقول الحقيقة. يقول كا أن يولاند يقول الحقيقة. يقول إنجا كا يقول الحقيقة. هل تقول إنجا الحقيقة؟,نعم
سؤال: دلفينا تكذب. يقول جيري أن دلفينا تقول الحقيقة. يقول مايبل جيري يقول الحقيقة. دالاس يقول مايبيل يكذب. كريستيان يقول أن دالاس يقول الحقيقة. هل يقول كريستيان الحقيقة؟,نعم
سؤال: جوين يقول الحقيقة. أندري يقول جوين يخبر الحقيقة. يولاند يقول أندريه يكذب. يقول سال إن يولاند يكذب. يقول كريستا إن سال يكذب. هل تقول كريستا الحقيقة؟,No
سؤال: كريستا تقول الحقيقة. يقول جيم أن كريستا تكذب. يقول دلفينا أن جيم يكذب. تقول فيبي أن دلفينا تكذب. تقول بيرنيتا أن فيبي تقول الحقيقة. هل تقول برنيتا الحقيقة؟,No
سؤال: جيم يقول الحقيقة. أليخاندرو يقول أن جيم يكذب. تقول فيبي أن أليخاندرو يكذب. يقول شاوندا أن فيبي تقول الحقيقة. كاندي يقول شاوندا أكاذيب. هل تقول كاندي الحقيقة؟,No
سؤال: أوزفالدو أكاذيب. يقول رايان أوزفالدو يكذب. يقول أندري إن ريان يقول الحقيقة. تقول رشيدة أن أندري يقول الحقيقة. تقول ميلي أن رشيدة تقول الحقيقة. هل ميلي تقول الحقيقة؟,نعم
سؤال: يولاند تقول الحقيقة. تقول ميكايلا إن يولاند يقول الحقيقة. تقول سيما إن ميكايلا تقول الحقيقة. يقول شاوندا أن سيما تقول الحقيقة. يقول أوزفالدو إن شاوندا تكذب. هل يقول أوزفالدو الحقيقة؟,No
سؤال: الحمل يكمن. تقول رشيدة إن الحمل يقول الحقيقة. أليجاندرو يقول رشيدة تقول الحقيقة. تقول شيري أن أليخاندرو يكذب. تقول أمبرلي أن شيري تقول الحقيقة. هل يقول أمبرلي الحقيقة؟,نعم
سؤال: تيريسا تقول الحقيقة. يقول فيرنيل إن تيريسا تكذب. تقول شيري أن فيرنيل يقول الحقيقة. تاميكا تقول شيري تكذب. يقول ميليسنت أن تاميكا تقول الحقيقة. هل يقول ميليسنت الحقيقة؟,نعم
سؤال: يكذب فيرنيل. يقول مايكل فيرنيل يكذب. دالاس يقول مايكل يكذب. يقول شالوندا إن دالاس يقول الحقيقة. جامي يقول شالوندا يكذب. هل جامع يقول الحقيقة؟,نعم
سؤال: جيم يقول الحقيقة. يقول رايان أن جيم يقول الحقيقة. يقول ميليسنت أن ريان يقول الحقيقة. تقول أودري ميليسنت تقول الحقيقة. يقول إيلانور أن أودري تقول الحقيقة. هل تقول إيلانور الحقيقة؟,نعم
سؤال: الينور تكذب. يقول دالاس أن إيلانور تقول الحقيقة. يقول فليتشر إن دالاس يكذب. يقول جامي فليتشر يقول الحقيقة. تقول دلفينا أن جامع تكذب. هل تقول دلفينا الحقيقة؟,No
سؤال: اليخاندرو يقول الحقيقة. تقول شنا أن أليخاندرو يقول الحقيقة. تقول كريستي إن شينا تقول الحقيقة. شالوندا تقول كريستي تكذب. جيري يقول شالوندا يكذب. هل يقول جيري الحقيقة؟,نعم
سؤال: أوزفالدو أكاذيب. تقول فيبي إن أوزفالدو يكذب. كاندي يقول فيبي الحقيقة. يقول كريستا إن كاندي يقول الحقيقة. يقول دلبيرت أن كريستا تكذب. هل يقول ديلبرت الحقيقة؟,No
سؤال: برنيتا تكذب. جيري يقول بيرنيتا تقول الحقيقة. يقول Delbert أن جيري يكذب. يقول جامي أن ديلبرت يقول الحقيقة. شنا تقول جامع يكذب. هل شنا تقول الحقيقة؟,No
سؤال: ويليان يقول الحقيقة. تقول فيبي أن ويليان يكذب. أليخاندرو يقول فيبي تكذب. تقول لورين أن أليخاندرو يقول الحقيقة. كريستي تقول لورين تقول الحقيقة. هل تقول كريستي الحقيقة؟,نعم
سؤال: ميليسنت تقول الحقيقة. يقول فيرنيل إن ميليسنت أكاذيب. تقول Tamika أن Vernell يقول الحقيقة. يقول أوزفالدو إن تاميكا تقول الحقيقة. شينا تقول أكاذيب أوزفالدو. هل شنا تقول الحقيقة؟,نعم
سؤال: أكاذيب أمبرلي. شالوندا يقول أمبرلي يخبر الحقيقة. تقول هيلين أن شالوندا يقول الحقيقة. تقول سيما أن هيلين تقول الحقيقة. تقول كريستي إن سيما تقول الحقيقة. هل تقول كريستي الحقيقة؟,No
سؤال: كريستي تكذب. Jaymie يقول كريستي يكذب. تقول لورين أن جيمي يقول الحقيقة. تقول بيرنيتا لورين تقول الحقيقة. تقول دلفينا أن بيرنيتا تكذب. هل تقول دلفينا الحقيقة؟,No
سؤال: هيلين تقول الحقيقة. تقول تيريسا أن هيلين تقول الحقيقة. جامي يقول تيريسا تكذب. الكسيس يقول جامي يكذب. يقول أوزفالدو أن أليكسيس يقول الحقيقة. هل يقول أوزفالدو الحقيقة؟,نعم
سؤال: ويليان يقول الحقيقة. ميكايلا تقول أن ويليان يكذب. الحمل يقول ميكايلا أكاذيب. تقول إنجا إن الحمل يقول الحقيقة. سال يقول إنجا أكاذيب. هل يقول سال الحقيقة؟,No
سؤال: لورين تكذب. يقول أوزفالدو إن لورين تكذب. أليخاندرو يقول أكاذيب أوزفالدو. يقول جوين أن أليخاندرو يقول الحقيقة. دالاس يقول جوين يكذب. هل يقول دالاس الحقيقة؟,نعم
سؤال: كريستي تقول الحقيقة. تقول إيلانور أن كريستي تكذب. يقول جيمي أن إيلانور تقول الحقيقة. Jamey يقول Jaymie يكذب. يقول أليكسيس إن جامي يقول الحقيقة. هل يقول الكسيس الحقيقة؟,نعم
سؤال: مايبيل تقول الحقيقة. يقول أوزفالدو إن مايبيل تكذب. كاندي يقول أوزفالدو يكذب. جيري يقول كاندي يكذب. أليخاندرو يقول جيري يكذب. هل اليخاندرو يقول الحقيقة؟,نعم
سؤال: اليخاندرو يكذب. تقول فينا أن أليخاندرو يكذب. يقول فيرنيل إن فينا تقول الحقيقة. يقول فيدل إن فيرنيل يكذب. تقول إنجا أن فيدل يقول الحقيقة. هل تقول إنجا الحقيقة؟,No
سؤال: ميليسنت تقول الحقيقة. يقول ويليان أكاذيب ميليسنت. يقول كريستا أن ويليان يكذب. تقول تيريسا أن كريستا تقول الحقيقة. رشيدة تقول أن تيريسا تقول الحقيقة. هل تقول رشيدة الحقيقة؟,نعم
سؤال: أوزفالدو أكاذيب. يقول جوين أكاذيب أوزفالدو. مايكل يقول جوين يكذب. Elanor يقول مايكل يكذب. يقول سال أن إيلانور تقول الحقيقة. هل يقول سال الحقيقة؟,نعم
سؤال: كا الكذب. تقول لورين كا تقول الحقيقة. سال يقول لورين تكذب. يقول أمبرلي سال يكذب. الحمل يقول أمبرلي أكاذيب. هل الحمل يقول الحقيقة؟,نعم
سؤال: جيري يقول الحقيقة. يقول ريموند أن جيري يقول الحقيقة. يقول يولاند أن ريموند يقول الحقيقة. يقول إيلانور إن يولاند يقول الحقيقة. يقول جامي أن إيلانور تكذب. هل جامع يقول الحقيقة؟,No
سؤال: هيلين تقول الحقيقة. يقول ريموند إن هيلين تكذب. يقول أندريه أن ريموند يقول الحقيقة. يقول مايكل أن Andree يقول الحقيقة. يقول أمبرلي أن مايكل يقول الحقيقة. هل يقول أمبرلي الحقيقة؟,No
سؤال: ويليان يقول الحقيقة. يقول كريستا أن ويليان يقول الحقيقة. تقول فينا إن كريستا تكذب. فيدل يقول فينا يكذب. يقول فليتشر أن فيدل يكذب. هل يقول فليتشر الحقيقة؟,No
سؤال: لورين تقول الحقيقة. ميكايلا تقول لورين تكذب. يقول ميليسنت ميكايلا تقول الحقيقة. يقول فليتشر إن ميليسنت تقول الحقيقة. يقول شاوندا أن فليتشر يقول الحقيقة. هل تقول شاوندا الحقيقة؟,No
سؤال: جيري يكذب. جوين يقول جيري يكذب. يقول فيدل إن جوين تكذب. يقول ميليسنت أن فيدل يقول الحقيقة. تقول لورين إن ميليسنت تقول الحقيقة. هل تقول لورين الحقيقة؟,No
سؤال: ميلي أكاذيب. يقول Jaymie ميلي تقول الحقيقة. يقول Jamey أن Jaymie يقول الحقيقة. سال يقول جامي يكذب. كريستي تقول إن سال يكذب. هل تقول كريستي الحقيقة؟,No
سؤال: شالوندا تكذب. يقول كريستا أن شالوندا يقول الحقيقة. يقول يولاند أن كريستا تقول الحقيقة. يقول كا أن يولاند يقول الحقيقة. ميكايلا تقول أكاذيب كا. هل تقول ميكايلا الحقيقة؟,نعم
سؤال: مايبيل تقول الحقيقة. يقول أنطوان إن مايبيل تقول الحقيقة. تقول أودري أن أنطوان يقول الحقيقة. يقول ريان أن أودري تكذب. تقول دلفينا إن ريان يكذب. هل تقول دلفينا الحقيقة؟,نعم
سؤال: برنيتا تقول الحقيقة. كا يقول بيرنيتا يكذب. يولاند يقول كا الأكاذيب. جوين يقول يولاند يكذب. يقول فيدل إن جوين تكذب. هل يقول فيدل الحقيقة؟,نعم
سؤال: أودري تقول الحقيقة. يقول ريان أن أودري تكذب. رشيدة تقول ريان يكذب. يقول فليتشر أن رشيدة تقول الحقيقة. يقول شاوندا أن فليتشر يقول الحقيقة. هل تقول شاوندا الحقيقة؟,نعم
سؤال: دلفينا تكذب. تقول تيريسا أن دلفينا تكذب. تقول أمبرلي أن تيريسا تقول الحقيقة. يقول رايان يكذب أمبرلي. ميلي يقول رايان يكذب. هل ميلي تقول الحقيقة؟,نعم
سؤال: ويليان يقول الحقيقة. تقول ميكايلا إن ويليان يقول الحقيقة. سيما تقول ميكايلا تكذب. تقول إنجا إن سيما تقول الحقيقة. تقول أودري إنجا تكذب. هل تقول أودري الحقيقة؟,نعم
سؤال: تيريسا تقول الحقيقة. تقول لورين أن تيريسا تكذب. أنطوان يقول لورين تقول الحقيقة. يقول فيدل إن أنطوان يقول الحقيقة. تقول فيبي أن فيدل يكذب. هل فيبي تقول الحقيقة؟,نعم
سؤال: إيلانور تقول الحقيقة. تقول كريستا أن إيلانور تكذب. يقول فيرنيل إن كريستا تكذب. يقول شالوندا أن فيرنيل يكذب. تقول تيريسا أن شالوندا يكذب. هل تقول تيريسا الحقيقة؟,نعم
سؤال: يولاند تقول الحقيقة. يقول جوين إن يولاند يقول الحقيقة. تقول ميكايلا إن جوين يكذب. يقول جامي ميكايلا تقول الحقيقة. يقول أمبرلي أن جامع يكذب. هل يقول أمبرلي الحقيقة؟,نعم
سؤال: جوين يقول الحقيقة. ميليسنت يقول جوين يكذب. يقول أنطوان إن ميليسنت تقول الحقيقة. تقول تيريسا أنطوان يكذب. شينا تقول أن تيريسا تكذب. هل شنا تقول الحقيقة؟,No
سؤال: هيلين تقول الحقيقة. تقول ليدا هيلين تكذب. يقول أنطوان أن ليدا تقول الحقيقة. أندري يقول أنطوان يكذب. شاوندا يقول اندريه يكذب. هل تقول شاوندا الحقيقة؟,No
سؤال: شيري تقول الحقيقة. يقول كاندي أن شيري تقول الحقيقة. الحمل يقول كاندي يقول الحقيقة. يقول مايكل إن Conception يقول الحقيقة. كريستي يقول مايكل يقول الحقيقة. هل تقول كريستي الحقيقة؟,نعم
سؤال: دلبرت يقول الحقيقة. يقول جوين أن ديلبرت يكذب. تقول أودري جوين يكذب. تقول كريستي أن أودري تكذب. يقول أليكسيس أن كريستي تكذب. هل يقول الكسيس الحقيقة؟,نعم
سئل: انطوان يقول الحقيقة. جيمي يقول أنطوان يقول الحقيقة. تقول مايبيلي أن جايمي يقول الحقيقة. الكسيس يقول مايبيل يكذب. ميليسنت يقول الكسيس يكذب. هل يقول ميليسنت الحقيقة؟,نعم
سؤال: دلفينا تقول الحقيقة. يقول فيدل إن دلفينا تقول الحقيقة. هيلين تقول فيدل يكذب. يقول كريستا هيلين تكذب. كا يقول كريستا أكاذيب. هل يقول كا الحقيقة؟,No
سؤال: جيم يكذب. يولاند يقول جيم يكذب. يقول ويليان إن يولاند يقول الحقيقة. يقول دلبيرت أن ويليان يكذب. يقول شالوندا أن ديلبرت يقول الحقيقة. هل شالوندا يقول الحقيقة؟,No
سؤال: الينور تكذب. يقول ميليسنت أن إيلانور تقول الحقيقة. يقول ميليسنت أكاذيب. تقول ميكايلا إن ميلي تقول الحقيقة. كاندي يقول ميكايلا تكذب. هل تقول كاندي الحقيقة؟,No
سؤال: جيري يقول الحقيقة. يولاند يقول جيري يكذب. تقول Tamika أن Yoland تقول الحقيقة. يقول الكسيس تاميكا تقول الحقيقة. يقول ريان أن أليكسيس تقول الحقيقة. هل يقول رايان الحقيقة؟,No
سؤال: سيما تقول الحقيقة. جيري يقول سيما تقول الحقيقة. سال يقول جيري يكذب. إنجا تقول سال أكاذيب. ويليان يقول إنجا تكذب. هل يقول ويليان الحقيقة؟,No
سؤال: ويليان يقول الحقيقة. يقول شالوندا أن ويليان يقول الحقيقة. تقول هيلين أن شالوندا يقول الحقيقة. ميليسنت يقول هيلين تكذب. يقول أندريه ميليسنت أكاذيب. هل يقول أندريه الحقيقة؟,نعم
سؤال: ريان يقول الحقيقة. يقول أمبرلي أن رايان يقول الحقيقة. كريستيان يقول أكاذيب أمبرلي. بيرنيتا يقول كريستيان أكاذيب. أليخاندرو يقول بيرنيتا تقول الحقيقة. هل اليخاندرو يقول الحقيقة؟,نعم
سؤال: فيرنيل يقول الحقيقة. رشيدة تقول يكذب فيرنيل. كريستي تقول رشيدة تقول الحقيقة. تقول شيري أن كريستي تقول الحقيقة. جيم يقول شيري تكذب. هل يقول جيم الحقيقة؟,نعم
سؤال: شوندا أكاذيب. يقول إيلانور إن شاوندا تكذب. يقول فيدل إن إيلانور تقول الحقيقة. تقول لورين أن فيدل يقول الحقيقة. يقول ريموند لورين تكذب. هل يقول ريموند الحقيقة؟,No
سؤال: جوين يقول الحقيقة. لورين تقول جوين يكذب. أنطوان يقول لورين تقول الحقيقة. يقول إيلانور إن أنطوان يقول الحقيقة. يقول دلفينا أن إيلانور تقول الحقيقة. هل تقول دلفينا الحقيقة؟,No
سؤال: شنا تقول الحقيقة. انطوان يقول شنا تكذب. تاميكا تقول أنطوان يكذب. يقول إيلانور إن تاميكا تكذب. تقول رشيدة أن إيلانور تقول الحقيقة. هل تقول رشيدة الحقيقة؟,No
سؤال: اندريه يكذب. تقول رشيدة أن أندري يقول الحقيقة. تقول أمبرلي رشيدة تكذب. تاميكا تقول أكاذيب أمبرلي. تقول ليدا تاميكا تكذب. هل تقول ليدا الحقيقة؟,نعم
سؤال: ريان يكذب. Jaymie يقول ريان يكذب. يقول مايكل أن Jaymie يقول الحقيقة. كا يقول مايكل يكذب. يقول ميليسنت أن كا تقول الحقيقة. هل يقول ميليسنت الحقيقة؟,No
سؤال: اليخاندرو يكذب. بيرنيتا يقول أن اليخاندرو يكذب. أندريه يقول بيرنيتا تقول الحقيقة. تقول سيما أن أندري يقول الحقيقة. تقول إنجا إن سيما تقول الحقيقة. هل تقول إنجا الحقيقة؟,نعم
سؤال: شنا تكذب. يقول كريستا إن شنا تكذب. يقول أندري أن كريستا تقول الحقيقة. شيري تقول اندريه يكذب. كا تقول شيري تكذب. هل يقول كا الحقيقة؟,نعم
سئل: انطوان يكذب. جيري يقول انطوان يقول الحقيقة. تقول دلفينا إن جيري يكذب. يقول الحمل أن دلفينا تكذب. تقول بيرنيتا إن الحمل يقول الحقيقة. هل تقول برنيتا الحقيقة؟,No
