مدخل,هدف
سؤال: أودري يكذب. يقول جيري أن أودري تقول الحقيقة. أليخاندرو يقول جيري يكذب. Jaymie يقول أن اليخاندرو يكذب. تقول لورين أن جيمي يقول الحقيقة. هل تقول لورين الحقيقة؟,No
سؤال: ويليان يكذب. يقول فيدل أن ويليان يقول الحقيقة. يقول كريستا إن فيدل يقول الحقيقة. تقول إنجا أن كريستا تقول الحقيقة. دالاس يقول إنجا أكاذيب. هل يقول دالاس الحقيقة؟,نعم
سؤال: شيري تكذب. جوين يقول شيري تكذب. سيما تقول جوين يكذب. تاميكا تقول سيما تقول الحقيقة. يقول ميليسنت أن تاميكا تقول الحقيقة. هل يقول ميليسنت الحقيقة؟,No
سؤال: فيرنيل يقول الحقيقة. يقول فيدل إن فيرنيل يقول الحقيقة. أمبرلي يقول فيدل يكذب. لورين تقول تكذب أمبرلي. إيلانور تقول لورين تكذب. هل تقول إيلانور الحقيقة؟,No
سؤال: أكاذيب الألفية. تقول لورين ميليسنت أكاذيب. رشيدة تقول لورين تكذب. سيما تقول رشيدة تكذب. تقول فيبي إن سيما تقول الحقيقة. هل فيبي تقول الحقيقة؟,نعم
سؤال: فينا تقول الحقيقة. أليخاندرو يقول فينا يكذب. يقول مايبيل أن أليخاندرو يقول الحقيقة. Millicent يقول Maybelle يكذب. يقول إيلانور إن ميليسنت تقول الحقيقة. هل تقول إيلانور الحقيقة؟,نعم
سؤال: شاوندا تقول الحقيقة. الحمل يقول شاوندا أكاذيب. تقول شنا إن الحمل يكذب. يقول دلبرت إن شنا تكذب. يقول جيري أن ديلبرت يقول الحقيقة. هل يقول جيري الحقيقة؟,No
سؤال: جيري يقول الحقيقة. يقول Jaymie جيري يقول الحقيقة. يقول Elanor أن Jaymie يقول الحقيقة. تقول هيلين أن إيلانور تقول الحقيقة. تقول شيري أن هيلين تقول الحقيقة. هل شيري تقول الحقيقة؟,نعم
سؤال: ميليسنت تقول الحقيقة. يقول كا ميليسنت يقول الحقيقة. يقول الحمل كا الأكاذيب. يقول سال إن الحمل يكذب. تاميكا تقول سال يكذب. هل تاميكا تقول الحقيقة؟,No
سؤال: شوندا أكاذيب. يقول فليتشر إن شاوندا تكذب. جايمي يقول فليتشر يكذب. ميلي يقول Jaymie يكذب. يقول جوين إن ميلي تقول الحقيقة. هل يقول جوين الحقيقة؟,نعم
سؤال: كريستي تكذب. يقول أمبرلي أن كريستي تقول الحقيقة. بيرنيتا تقول أمبرلي تقول الحقيقة. كريستيان يقول بيرنيتا تكذب. دلفينا يقول كريستيان أكاذيب. هل تقول دلفينا الحقيقة؟,No
سؤال: ليدا تكذب. يقول فيدل أن ليدا تكذب. يقول كريستا إن فيدل يقول الحقيقة. كا يقول كريستا أكاذيب. جيم يقول كا يقول الحقيقة. هل يقول جيم الحقيقة؟,No
سؤال: ليدا تكذب. يقول ميليسنت أن ليدا تقول الحقيقة. رشيدة تقول ميليسنت أكاذيب. تقول مايبيلي أن رشيدة تقول الحقيقة. شاوندا يقول مايبيل يكذب. هل تقول شاوندا الحقيقة؟,No
سؤال: رشيدة تكذب. يقول أوزفالدو إن رشيدة تقول الحقيقة. تقول شيري أن أوزفالدو يقول الحقيقة. يقول جوين أن شيري تقول الحقيقة. جيري يقول جوين يكذب. هل يقول جيري الحقيقة؟,نعم
سؤال: برنيتا تقول الحقيقة. تقول أودري برنيتا تكذب. تقول ميلي أن أودري تقول الحقيقة. كاندي يقول ميلي تكذب. يقول فليتشر أن كاندي تقول الحقيقة. هل يقول فليتشر الحقيقة؟,نعم
سؤال: رشيدة تقول الحقيقة. جيم يقول رشيدة تكذب. تاميكا تقول أن جيم يقول الحقيقة. تقول لورين تاميكا تقول الحقيقة. تقول فينا لورين تقول الحقيقة. هل تقول فينا الحقيقة؟,No
سؤال: ديلبيرت أكاذيب. يقول شالوندا أن ديلبرت يقول الحقيقة. تاميكا تقول شالوندا يكذب. سال يقول تاميكا أكاذيب. تقول هيلين سال تكذب. هل هيلين تقول الحقيقة؟,نعم
سؤال: فيبي تكذب. تقول لورين فيبي تقول الحقيقة. دالاس يقول لورين تكذب. يقول أليكسيس إن دالاس يكذب. يقول جيم أن أليكسيس تقول الحقيقة. هل يقول جيم الحقيقة؟,No
سؤال: أودري يكذب. رشيدة تقول أن أودري تقول الحقيقة. مايبيل تقول رشيدة تكذب. كا يقول أكاذيب مايبيل. يقول شاوندا أن كا تقول الحقيقة. هل تقول شاوندا الحقيقة؟,No
سؤال: أوزفالدو أكاذيب. يقول فليتشر أن أوزفالدو يقول الحقيقة. مايكل يقول فليتشر يقول الحقيقة. دالاس يقول مايكل يقول الحقيقة. تقول تيريسا أن دالاس يقول الحقيقة. هل تقول تيريسا الحقيقة؟,No
سؤال: الكسيس يقول الحقيقة. يقول ريموند أن أليكسيس يقول الحقيقة. تقول ميكايلا إن ريموند يقول الحقيقة. يقول شالوندا إن ميكايلا تقول الحقيقة. يقول أمبرلي أن شالوندا يقول الحقيقة. هل يقول أمبرلي الحقيقة؟,نعم
سؤال: ريمون يكذب. يقول فليتشر أن ريموند يكذب. يقول أمبرلي فليتشر يكذب. تقول شنا أمبرلي تقول الحقيقة. يقول دالاس إن شينا تقول الحقيقة. هل يقول دالاس الحقيقة؟,No
سؤال: شالوندا يقول الحقيقة. يقول سال إن شالوندا يقول الحقيقة. تقول هيلين إن سال يقول الحقيقة. كاندي يقول هيلين تكذب. تقول لورين أن كاندي تقول الحقيقة. هل تقول لورين الحقيقة؟,No
سؤال: سال يقول الحقيقة. يقول أليخاندرو إن سال يقول الحقيقة. يقول ريموند أن أليخاندرو يكذب. يقول الحمل أن ريموند يكذب. يقول إيلانور إن الحمل يكذب. هل تقول إيلانور الحقيقة؟,No
سؤال: شاوندا تقول الحقيقة. يقول فيدل إن شاوندا تقول الحقيقة. يقول ديلبرت إن فيدل يقول الحقيقة. تقول بيرنيتا أن ديلبرت يقول الحقيقة. لورين تقول بيرنيتا تكذب. هل تقول لورين الحقيقة؟,No
سؤال: فليتشر يكذب. جيري يقول فليتشر يكذب. يقول ريموند جيري يكذب. يقول الحمل أن ريموند يكذب. يقول Amberly Conception يقول الحقيقة. هل يقول أمبرلي الحقيقة؟,نعم
سؤال: كريستيان أكاذيب. ميلي يقول كريستيان أكاذيب. يقول أمبرلي ميلي أكاذيب. يقول أوزفالدو إن أمبرلي تقول الحقيقة. يقول كاندي أن أوزفالدو يقول الحقيقة. هل تقول كاندي الحقيقة؟,No
سؤال: ويليان يكذب. يقول ريموند أن ويليان يقول الحقيقة. رشيدة تقول ريمون يكذب. يقول جوين رشيدة تكذب. كا يقول جوين يكذب. هل يقول كا الحقيقة؟,نعم
سؤال: جامع يقول الحقيقة. يقول مايكل أن جامع يكذب. شيري تقول مايكل يكذب. بيرنيتا تقول شيري تكذب. تقول أمبرلي أن بيرنيتا تقول الحقيقة. هل يقول أمبرلي الحقيقة؟,No
سؤال: شاوندا تقول الحقيقة. جيم يقول شاوندا أكاذيب. الكسيس يقول جيم يكذب. تقول فيبي أن أليكسيس يقول الحقيقة. تقول شيري أن فيبي تقول الحقيقة. هل شيري تقول الحقيقة؟,نعم
سؤال: أكاذيب الألفية. يقول كا ميليسنت أكاذيب. تقول سيما أن كا تقول الحقيقة. يقول دالاس أن سيما تقول الحقيقة. يقول جامي إن دالاس يكذب. هل جامع يقول الحقيقة؟,No
سؤال: كريستي تقول الحقيقة. يقول فيدل أن كريستي تكذب. يقول جيري أن فيدل يقول الحقيقة. مايبيل يقول جيري يكذب. تقول دلفينا إن مايبيلي تقول الحقيقة. هل تقول دلفينا الحقيقة؟,نعم
سؤال: سيما أكاذيب. تقول مايبيلي إن سيما تقول الحقيقة. تقول أودري أكاذيب مايبيل. تقول ليدا أن أودري تقول الحقيقة. يقول شاوندا أن ليدا تكذب. هل تقول شاوندا الحقيقة؟,No
سؤال: يكذب فيرنيل. يقول الحمل إن فيرنيل يكذب. كاندي يقول الحمل يكذب. يقول مايكل أن كاندي يقول الحقيقة. يقول أوزفالدو إن مايكل يقول الحقيقة. هل يقول أوزفالدو الحقيقة؟,No
سؤال: شاوندا تقول الحقيقة. يقول ديلبرت أن شاوندا تقول الحقيقة. بيرنيتا تقول أكاذيب ديلبرت. يقول يولاند أن بيرنيتا تقول الحقيقة. تقول كريستي إن يولاند يقول الحقيقة. هل تقول كريستي الحقيقة؟,No
سؤال: إنجا تقول الحقيقة. يقول شالوندا إنجا تقول الحقيقة. تقول فيبي أن شالوندا يقول الحقيقة. يقول كريستا فيبي تكذب. أليخاندرو يقول كريستا تكذب. هل اليخاندرو يقول الحقيقة؟,نعم
سئل: فيدل يكذب. يقول ميليسنت أن فيدل يقول الحقيقة. يقول كريستا أكاذيب ميليسنت. تقول ليدا أن كريستا تكذب. تقول تاميكا أن ليدا تقول الحقيقة. هل تاميكا تقول الحقيقة؟,No
سؤال: أندريه يقول الحقيقة. تقول كريستي أن أندري يقول الحقيقة. يقول فيدل أن كريستي تكذب. أنطوان يقول إن فيدل يقول الحقيقة. أليخاندرو يقول أنطوان يكذب. هل اليخاندرو يقول الحقيقة؟,نعم
سؤال: فليتشر يقول الحقيقة. يقول ويليان فليتشر يقول الحقيقة. جامي يقول ويليان يكذب. ليدا تقول جامع يكذب. يقول Jaymie أن Leda تقول الحقيقة. هل Jaymie يقول الحقيقة؟,نعم
سؤال: تاميكا أكاذيب. يقول جيري تاميكا تقول الحقيقة. يقول Delbert أن جيري يقول الحقيقة. تقول ليدا أن ديلبرت يقول الحقيقة. يقول ويليان أن ليدا تكذب. هل يقول ويليان الحقيقة؟,نعم
سؤال: تيريسا تكذب. يقول سال أن تيريسا تقول الحقيقة. يقول ديلبرت إن سال يقول الحقيقة. تقول تاميكا أن ديلبرت يقول الحقيقة. يقول جوين تاميكا تقول الحقيقة. هل يقول جوين الحقيقة؟,No
سؤال: جيم يكذب. يقول دلفينا أن جيم يقول الحقيقة. يقول شاوندا أن دلفينا تكذب. يقول فيدل إن شاوندا تكذب. يقول سال إن فيدل يقول الحقيقة. هل يقول سال الحقيقة؟,No
سؤال: ميلي أكاذيب. يقول مايكل أن ميلي تقول الحقيقة. تقول فينا أن مايكل يكذب. يقول الحمل إن فينا تقول الحقيقة. تقول سيما إن الحمل يقول الحقيقة. هل سيما تقول الحقيقة؟,نعم
سؤال: كاندي أكاذيب. تقول ميلي أن كاندي تقول الحقيقة. تقول لورين ميلي تقول الحقيقة. ميكايلا تقول لورين تقول الحقيقة. يقول أمبرلي أن ميكايلا تكذب. هل يقول أمبرلي الحقيقة؟,نعم
سؤال: مايكل يكذب. يقول جيري أن مايكل يقول الحقيقة. يقول Delbert أن جيري يقول الحقيقة. سيما تقول أن ديلبرت يكذب. الكسيس يقول سيما الأكاذيب. هل يقول الكسيس الحقيقة؟,No
سؤال: شال أكاذيب. كريستيان يقول سال يكذب. هيلين تقول كريستيان أكاذيب. تقول إنجا أن هيلين تقول الحقيقة. يقول مايكل إنجا تقول الحقيقة. هل يقول مايكل الحقيقة؟,No
سؤال: مايبيل يكذب. تقول كريستا إن مايبيلي تقول الحقيقة. تقول بيرنيتا إن كريستا تكذب. كاندي يقول بيرنيتا تقول الحقيقة. يقول ديلبرت إن كاندي يقول الحقيقة. هل يقول ديلبرت الحقيقة؟,نعم
سؤال: كا الكذب. رشيدة تقول أن كا تقول الحقيقة. شيري تقول رشيدة تقول الحقيقة. تقول تاميكا أن شيري تقول الحقيقة. يقول إيلانور إن تاميكا تقول الحقيقة. هل تقول إيلانور الحقيقة؟,No
سئل: انطوان يقول الحقيقة. تقول أودري أن أنطوان يقول الحقيقة. إنجا تقول أن أودري تكذب. تقول شينا إنجا تقول الحقيقة. تقول كريستي إن شنا تكذب. هل تقول كريستي الحقيقة؟,نعم
سؤال: تيريسا تكذب. يقول مايكل أن تيريسا تقول الحقيقة. يقول فيدل أن مايكل يقول الحقيقة. تقول ليدا أن فيدل يكذب. لورين تقول ليدا تكذب. هل تقول لورين الحقيقة؟,No
سئل: انطوان يقول الحقيقة. يقول إيلانور إن أنطوان يقول الحقيقة. تقول بيرنيتا أن إيلانور تقول الحقيقة. يقول أوزفالدو إن بيرنيتا تكذب. تقول كريستي أن أوزفالدو يقول الحقيقة. هل تقول كريستي الحقيقة؟,No
سؤال: إنجا تقول الحقيقة. يقول Elanor إنغا تكذب. يقول ميليسنت أن إيلانور تقول الحقيقة. يقول ويليان إن ميليسنت يقول الحقيقة. أليخاندرو يقول أن ويليان يقول الحقيقة. هل اليخاندرو يقول الحقيقة؟,No
سؤال: شيري تكذب. تقول إيلانور أن شيري تقول الحقيقة. يقول مايكل أن Elanor تقول الحقيقة. تقول سيما أن مايكل يقول الحقيقة. شاوندا تقول سيما تكذب. هل تقول شاوندا الحقيقة؟,نعم
سؤال: تاميكا أكاذيب. الحمل يقول تاميكا تقول الحقيقة. يقول كريستيان إن الحمل يكذب. أليخاندرو يقول كريستيان يقول الحقيقة. يقول شاوندا أن أليخاندرو يكذب. هل تقول شاوندا الحقيقة؟,No
سؤال: هيلين تكذب. تقول دلفينا أن هيلين تكذب. تقول كريستي أن دلفينا تقول الحقيقة. جيري يقول كريستي يكذب. تاميكا يقول جيري يقول الحقيقة. هل تاميكا تقول الحقيقة؟,No
سؤال: الحمل يكمن. تقول شنا إن الحمل يقول الحقيقة. تقول مايبيل إن شينا تقول الحقيقة. يقول مايكل أن Maybelle تكذب. يقول أمبرلي أن مايكل يكذب. هل يقول أمبرلي الحقيقة؟,No
سؤال: كريستيان يقول الحقيقة. يقول جامي إن كريستيان يقول الحقيقة. ميليسنت يقول جامي يكذب. يقول فيدل إن ميليسنت أكاذيب. تاميكا تقول فيدل يكذب. هل تاميكا تقول الحقيقة؟,No
سؤال: جامع يكذب. يقول سال إن جامي يقول الحقيقة. تقول تيريسا سال أكاذيب. تقول مايبيلي أن تيريسا تقول الحقيقة. كا يقول أكاذيب مايبيل. هل يقول كا الحقيقة؟,No
سؤال: لورين تكذب. يقول أمبرلي لورين تكذب. يقول فليتشر يكذب أمبرلي. تقول ميلي إن فليتشر يقول الحقيقة. انطوان يقول ميلي تكذب. هل يقول انطوان الحقيقة؟,نعم
سؤال: الكسيس يقول الحقيقة. يقول إيلانور إن أليكسيس يقول الحقيقة. شيري تقول أن إيلانور تكذب. تقول أودري أن شيري تقول الحقيقة. تقول إنجا أن أودري تقول الحقيقة. هل تقول إنجا الحقيقة؟,No
سؤال: فيدل يقول الحقيقة. تقول تيريسا أن فيدل يقول الحقيقة. يقول ويليان أن تيريسا تقول الحقيقة. الحمل يقول أن ويليان يقول الحقيقة. تقول بيرنيتا إن الحمل يكذب. هل تقول برنيتا الحقيقة؟,No
سؤال: جيري يقول الحقيقة. لورين تقول جيري يكذب. شينا تقول لورين تكذب. جوين يقول شنا يكذب. شاوندا يقول جوين يكذب. هل تقول شاوندا الحقيقة؟,نعم
سؤال: إنجا أكاذيب. تقول أودري إنجا تكذب. رشيدة تقول أودري تكذب. ويليان يقول رشيدة تقول الحقيقة. يقول أمبرلي أن ويليان يكذب. هل يقول أمبرلي الحقيقة؟,نعم
سؤال: كا يقول الحقيقة. تقول إنجا كا الأكاذيب. بيرنيتا تقول إنجا تكذب. يقول أوزفالدو إن بيرنيتا تقول الحقيقة. ميكايلا تقول أكاذيب أوزفالدو. هل تقول ميكايلا الحقيقة؟,No
سؤال: Jaymie يكذب. يقول Jamey أن Jaymie يقول الحقيقة. سال يقول جامي يكذب. يقول أمبرلي سال يكذب. يقول جيري أمبرلي يخبر الحقيقة. هل يقول جيري الحقيقة؟,No
سؤال: ميلي أكاذيب. أندري يقول ميلي تكذب. ميكايلا يقول أندريه يكذب. تقول ليدا إن ميكايلا تقول الحقيقة. شينا تقول ليدا تكذب. هل شنا تقول الحقيقة؟,نعم
سؤال: شاوندا تقول الحقيقة. تقول مايبيل إن شاوندا تقول الحقيقة. لورين تقول مايبيل تكذب. تقول ميلي إن لورين تقول الحقيقة. تقول فينا إن ميلي تقول الحقيقة. هل تقول فينا الحقيقة؟,No
سؤال: فليتشر يكذب. تقول تاميكا إن فليتشر يقول الحقيقة. كا يقول تاميكا أكاذيب. تقول سيما أن كا تقول الحقيقة. يقول ريان إن سيما تقول الحقيقة. هل يقول رايان الحقيقة؟,نعم
سؤال: شوندا أكاذيب. أندريه يقول شاوندا يقول الحقيقة. Jaymie يقول Andree يكذب. يقول إنجا Jaymie يكذب. يقول ميليسنت إنجا تقول الحقيقة. هل يقول ميليسنت الحقيقة؟,No
سؤال: رشيدة تكذب. فليتشر يقول رشيدة تكذب. أنطوان يقول فليتشر يكذب. ويليان يقول أنطوان يقول الحقيقة. تقول فينا أن ويليان يقول الحقيقة. هل تقول فينا الحقيقة؟,No
سؤال: جيري يكذب. كاندي يقول جيري يكذب. فليتشر يقول كاندي يكذب. يقول ريان فليتشر يكذب. تقول دلفينا إن ريان يكذب. هل تقول دلفينا الحقيقة؟,No
سؤال: شاوندا تقول الحقيقة. تقول فيبي إن شاوندا تقول الحقيقة. يقول ريان أن فيبي تقول الحقيقة. تقول كريستي إن ريان يقول الحقيقة. تقول فينا أن كريستي تقول الحقيقة. هل تقول فينا الحقيقة؟,نعم
سؤال: الكسيس يقول الحقيقة. يقول أمبرلي أن أليكسيس يقول الحقيقة. يقول أندريه Amberly يقول الحقيقة. تقول فينا أن أندري يقول الحقيقة. تقول هيلين أن فينا تقول الحقيقة. هل هيلين تقول الحقيقة؟,نعم
سؤال: جوين يكذب. يقول مايبيل أن جوين يقول الحقيقة. يقول ريموند إن مايبيل تقول الحقيقة. يقول جامي أن ريموند يقول الحقيقة. أندري يقول جامي يكذب. هل يقول أندريه الحقيقة؟,نعم
سؤال: كاندي يقول الحقيقة. يقول ريان كاندي يكذب. تقول ميكايلا إن ريان يقول الحقيقة. سيما تقول ميكايلا تكذب. أندري يقول سيما تقول الحقيقة. هل يقول أندريه الحقيقة؟,نعم
سؤال: فليتشر يقول الحقيقة. يقول الكسيس فليتشر يكذب. جيري يقول الكسيس يكذب. يقول إيلانور أن جيري يقول الحقيقة. يقول جيم أن إيلانور تكذب. هل يقول جيم الحقيقة؟,No
سؤال: شيري تقول الحقيقة. يقول ريان شيري تكذب. تقول بيرنيتا إن ريان يقول الحقيقة. تاميكا تقول بيرنيتا تكذب. جيري يقول تاميكا تكذب. هل يقول جيري الحقيقة؟,No
