aporte,objetivo
"Tengo una tostadora, un auto y una mesa. ¿Cuantos objetos tengo?",3
"Tengo una papa, un repollo, una coliflor, un pato, una cebolla, una lechuga, un ajo, un oso, una cabeza de brócoli, una zanahoria, un pollo y tres ñames. ¿Cuántas verduras tengo?",11
"Tengo estufa, dos microondas, mesa, horno, tostadora, cuatro sillas, auto y heladera. ¿Cuantos objetos tengo?",12
"Tengo un burro, un conejo, un pez y cinco gatos. ¿Cuantos animales tengo?",8
"Tengo un melocotón, una nectarina, un plátano, una frambuesa y un pato. ¿Cuántas frutas tengo?",4
"Tengo un ñame, dos cabezas de lechuga y una cabeza de brócoli. ¿Cuántas verduras tengo?",4
"Tengo un horno, una cama y una tostadora. ¿Cuantos objetos tengo?",3
"Tengo una manzana, una cabeza de brócoli, una nectarina, una uva, un plátano, una cebolla, una frambuesa, una fresa, dos melocotones, dos ciruelas, una naranja y tres moras. ¿Cuántas frutas tengo?",14
"Tengo un melocotón, una ciruela, una mora y una manzana. ¿Cuántas frutas tengo?",4
"Tengo tres tambores, una flauta, un clarinete, dos violines y una trompeta. ¿Cuántos instrumentos musicales tengo?",8
"Tengo tres violines, tres trombones, una flauta y cuatro trompetas. ¿Cuántos instrumentos musicales tengo?",11
"Tengo una lechuga, un repollo, una papa, una coliflor, un ñame, una cebolla y dos cabezas de brócoli. ¿Cuántas verduras tengo?",8
Tengo dos autos y un horno. ¿Cuantos objetos tengo?,3
"Tengo un pato, un gato, una rana, un ratón, un cerdo, un conejo, dos serpientes, un oso y tres cabras. ¿Cuantos animales tengo?",12
"Tengo un clarinete, un sofá, una flauta, cuatro sillas, cinco trombones, un tambor, una trompeta, un violín y un acordeón. ¿Cuántos instrumentos musicales tengo?",11
"Tengo una naranja, una uva, una fresa, tres manzanas, una ciruela, un plátano, una frambuesa, una mora, una nectarina y tres melocotones. ¿Cuántas frutas tengo?",14
"Tengo un auto, una heladera, un horno, una tostadora, un sofá, tres lámparas, cinco sillas, una estufa y un microondas. ¿Cuantos objetos tengo?",15
"Tengo una trompeta, un tambor, un acordeón y un piano. ¿Cuántos instrumentos musicales tengo?",4
"Tengo cuatro pianos, cuatro caracoles, tres gallinas, un cerdo, un perro y dos vacas. ¿Cuantos animales tengo?",11
"Tengo una trompeta, un tambor, un piano, una flauta y dos trombones. ¿Cuántos instrumentos musicales tengo?",6
"Tengo una cebolla, dos zanahorias, dos patatas, un tallo de apio, una cabeza de brócoli, una coliflor, una col, una lechuga, un ajo y un ñame. ¿Cuántas verduras tengo?",12
"Tengo un cerdo, un pez, un ratón, una rana, un perro, un conejo, un burro, una gallina y un pato. ¿Cuantos animales tengo?",9
"Tengo un ñame, un ajo, una lechuga, una patata, una lámpara, una zanahoria, dos cabezas de brócoli, un tallo de apio, una cebolla y tres coles. ¿Cuántas verduras tengo?",12
"Tengo una cabeza de brócoli, una cebolla, un ajo, dos zanahorias, una lechuga, dos coles, una coliflor, un tallo de apio, dos patatas y dos ñames. ¿Cuántas verduras tengo?",14
"Tengo un pato, una vaca, un burro, un ratón, un oso, una serpiente, un caracol y una cabra. ¿Cuantos animales tengo?",8
"Tengo tres sofás, una lámpara, una estufa, una mesa, una nevera y un microondas. ¿Cuantos objetos tengo?",8
"Tengo un tambor, un piano, un clarinete, cuatro violines, una flauta y dos trompetas. ¿Cuántos instrumentos musicales tengo?",10
"Tengo un piano, un acordeón, un trombón, dos clarinetes, dos violines, una trompeta, una flauta y un tambor. ¿Cuántos instrumentos musicales tengo?",10
"Tengo una cabra, una naranja, una nectarina, tres ciruelas y cuatro fresas. ¿Cuántas frutas tengo?",9
"Tengo una silla, una mesa, un sofá, una estufa, un auto, una lámpara y una heladera. ¿Cuantos objetos tengo?",7
"Tengo un pez, un caracol y dos conejos. ¿Cuantos animales tengo?",4
"Tengo un sofá, dos camas, una nevera, un horno, una lámpara y una mesa. ¿Cuantos objetos tengo?",7
"Tengo una cabeza de brócoli, cuatro ajos, un ñame, un tallo de apio, una col, dos patatas, una cebolla, cuatro cabezas de lechuga y una coliflor. ¿Cuántas verduras tengo?",16
